{
  "$schema": "http://json-schema.org/draft-07/schema#",
  "$comment": "GENERATED by gui/schema-gen/derive_nf_config_schemas.py from config/nwdaf.json + its source (ADR-0425). Do not edit; regenerate.",
  "title": "nwdaf",
  "type": "object",
  "additionalProperties": false,
  "properties": {
    "port": {
      "type": "integer",
      "x-env-override": "NWDAF_PORT",
      "x-cpp-type": "unsigned short"
    },
    "advertised_ipv4": {
      "type": "string",
      "x-env-override": "NWDAF_ADVERTISED_IPV4",
      "x-cpp-type": "std::string"
    },
    "sbi_bind_address": {
      "type": "string",
      "x-env-override": "NWDAF_SBI_BIND_ADDRESS",
      "x-cpp-type": "std::string"
    },
    "metrics_bind_address": {
      "type": "string",
      "x-env-override": "NWDAF_METRICS_BIND_ADDRESS",
      "x-cpp-type": "std::string"
    },
    "nrf_base_url": {
      "type": "string",
      "x-env-override": "NWDAF_NRF_BASE_URL",
      "x-cpp-type": "std::string"
    },
    "redis_url": {
      "type": "string",
      "x-env-override": "NWDAF_REDIS_URL",
      "x-cpp-type": "std::string"
    },
    "nrf_heartbeat_seconds": {
      "type": "integer",
      "x-env-override": "NWDAF_NRF_HEARTBEAT_SECONDS",
      "x-cpp-type": "int"
    },
    "notification_interval_seconds": {
      "type": "integer",
      "x-env-override": "NWDAF_NOTIFICATION_INTERVAL_SECONDS",
      "x-cpp-type": "int"
    },
    "nf_load_default_nf_types": {
      "type": "array",
      "items": {
        "type": "string"
      }
    },
    "abnormal_sigma_threshold": {
      "type": "number",
      "x-env-override": "NWDAF_ABNORMAL_SIGMA_THRESHOLD",
      "x-cpp-type": "double"
    },
    "abnormal_large_rate_floor_octets": {
      "type": "integer",
      "x-env-override": "NWDAF_ABNORMAL_LARGE_RATE_FLOOR_OCTETS",
      "x-cpp-type": "double"
    },
    "abnormal_session_count_threshold": {
      "type": "integer",
      "x-env-override": "NWDAF_ABNORMAL_SESSION_COUNT_THRESHOLD",
      "x-cpp-type": "std::int64_t"
    },
    "abnormal_max_exception_level": {
      "type": "integer",
      "x-cpp-type": "std::int64_t"
    },
    "abnormal_confidence_full_at_sessions": {
      "type": "integer",
      "x-cpp-type": "std::int64_t"
    },
    "energy_static_watts_per_slice": {
      "type": "number",
      "x-env-override": "NWDAF_ENERGY_STATIC_WATTS_PER_SLICE",
      "x-cpp-type": "double"
    },
    "energy_joules_per_gigabyte": {
      "type": "number",
      "x-env-override": "NWDAF_ENERGY_JOULES_PER_GIGABYTE",
      "x-cpp-type": "double"
    },
    "feature_store_host": {
      "type": "string",
      "x-env-override": "NWDAF_FEATURE_STORE_HOST",
      "x-cpp-type": "std::string"
    },
    "feature_store_port": {
      "type": "integer",
      "x-env-override": "NWDAF_FEATURE_STORE_PORT",
      "x-cpp-type": "std::uint16_t"
    },
    "feature_store_user": {
      "type": "string",
      "x-env-override": "NWDAF_FEATURE_STORE_USER",
      "x-cpp-type": "std::string"
    },
    "feature_store_password": {
      "type": "string",
      "x-env-override": "NWDAF_FEATURE_STORE_PASSWORD",
      "x-cpp-type": "std::string",
      "x-sensitivity": "credential"
    },
    "feature_store_database": {
      "type": "string",
      "x-env-override": "NWDAF_FEATURE_STORE_DATABASE",
      "x-cpp-type": "std::string"
    },
    "feature_store_max_rows": {
      "type": "integer",
      "x-env-override": "NWDAF_FEATURE_STORE_MAX_ROWS",
      "x-cpp-type": "std::int64_t"
    },
    "self_base_url": {
      "type": "string",
      "x-env-override": "NWDAF_SELF_BASE_URL",
      "x-cpp-type": "std::string"
    },
    "dccf_base_url": {
      "type": "string",
      "x-env-override": "NWDAF_DCCF_BASE_URL",
      "x-cpp-type": "std::string"
    },
    "data_collection": {
      "type": "object",
      "additionalProperties": false,
      "properties": {
        "via_dccf": {
          "type": "boolean"
        },
        "nrf_status_nf_types": {
          "type": "array"
        },
        "observation_window_seconds": {
          "type": "integer"
        },
        "max_collected_events": {
          "type": "integer"
        },
        "holder_heartbeat_seconds": {
          "type": "integer"
        }
      }
    },
    "fetch_buffer_ttl_seconds": {
      "type": "integer",
      "x-env-override": "NWDAF_FETCH_BUFFER_TTL_SECONDS",
      "x-cpp-type": "std::int64_t"
    },
    "user_consent_policy": {
      "type": "string",
      "x-env-override": "NWDAF_USER_CONSENT_POLICY",
      "x-cpp-type": "std::string"
    },
    "role": {
      "type": "string",
      "x-env-override": "NWDAF_ROLE",
      "x-cpp-type": "std::string"
    },
    "mtlf_base_url": {
      "type": "string",
      "x-env-override": "NWDAF_MTLF_BASE_URL",
      "x-cpp-type": "std::string"
    },
    "adrf_base_url": {
      "type": "string",
      "x-env-override": "NWDAF_ADRF_BASE_URL",
      "x-cpp-type": "std::string"
    },
    "ml_model_provision": {
      "type": "object",
      "additionalProperties": false,
      "properties": {
        "events": {
          "type": "array",
          "items": {
            "type": "string"
          }
        },
        "nf_types": {
          "type": "array"
        },
        "accuracy_threshold": {
          "type": "integer"
        },
        "holder_heartbeat_seconds": {
          "type": "integer"
        },
        "retry_seconds": {
          "type": "integer"
        }
      }
    },
    "mtlf": {
      "type": "object",
      "additionalProperties": false,
      "properties": {
        "events": {
          "type": "array",
          "items": {
            "type": "string"
          }
        },
        "data_set_id": {
          "type": "string"
        },
        "min_samples": {
          "type": "integer"
        },
        "accuracy_tolerance": {
          "type": "number"
        },
        "check_interval_seconds": {
          "type": "integer"
        },
        "retrain_min_new_windows": {
          "type": "integer"
        },
        "retrain_interval_seconds": {
          "type": "integer"
        },
        "training_lease_seconds": {
          "type": "integer"
        },
        "accuracy_threshold": {
          "type": "integer"
        },
        "retrain_cooldown_seconds": {
          "type": "integer"
        },
        "fl_client": {
          "type": "object",
          "additionalProperties": false,
          "properties": {
            "enabled": {
              "type": "boolean"
            },
            "script": {
              "type": "string"
            },
            "epochs": {
              "type": "integer"
            },
            "learning_rate": {
              "type": "number"
            },
            "accuracy_tolerance": {
              "type": "number"
            },
            "default_max_response_seconds": {
              "type": "integer"
            }
          }
        },
        "fl_server": {
          "type": "object",
          "additionalProperties": false,
          "properties": {
            "enabled": {
              "type": "boolean"
            },
            "aggregate_script": {
              "type": "string"
            },
            "round_grace_seconds": {
              "type": "integer"
            },
            "repeat_interval_seconds": {
              "type": "integer"
            },
            "federations": {
              "type": "array",
              "items": {
                "type": "object",
                "additionalProperties": false,
                "properties": {
                  "event": {
                    "type": "string"
                  },
                  "ml_corre_id": {
                    "type": "string"
                  },
                  "rounds": {
                    "type": "integer"
                  },
                  "min_clients": {
                    "type": "integer"
                  },
                  "max_res_time_seconds": {
                    "type": "integer"
                  }
                }
              }
            }
          }
        }
      }
    },
    "training": {
      "type": "object",
      "additionalProperties": false,
      "properties": {
        "python": {
          "type": "string"
        },
        "script": {
          "type": "string"
        },
        "workdir": {
          "type": "string"
        },
        "mlflow_tracking_uri": {
          "type": "string"
        },
        "timeout_seconds": {
          "type": "integer"
        }
      }
    },
    "accuracy_monitoring": {
      "type": "object",
      "additionalProperties": false,
      "properties": {
        "tolerance": {
          "type": "number"
        },
        "window_seconds": {
          "type": "integer"
        },
        "truth_timeout_seconds": {
          "type": "integer"
        },
        "check_interval_seconds": {
          "type": "integer"
        },
        "min_inferences": {
          "type": "integer"
        },
        "default_threshold": {
          "type": "integer"
        },
        "min_report_interval_seconds": {
          "type": "integer"
        }
      }
    },
    "smf_base_url": {
      "type": "string"
    },
    "li_poi": {
      "type": "object",
      "additionalProperties": false,
      "properties": {
        "enabled": {
          "type": "boolean"
        },
        "x1_bind_address": {
          "type": "string"
        },
        "x1_port": {
          "type": "integer"
        },
        "ne_identifier": {
          "type": "string"
        },
        "network_function_id": {
          "type": "string"
        },
        "interception_point_id": {
          "type": "string"
        },
        "mdf2_host": {
          "type": "string"
        },
        "mdf2_port": {
          "type": "integer"
        },
        "mdf2_sni": {
          "type": "string"
        },
        "x1_keepalive_p1_seconds": {
          "type": "integer"
        },
        "x1_keepalive_p2_seconds": {
          "type": "integer"
        },
        "x1_keepalive_p3_seconds": {
          "type": "integer"
        },
        "x1_allow_deactivate_all": {
          "type": "boolean"
        }
      }
    }
  },
  "required": [
    "abnormal_confidence_full_at_sessions",
    "abnormal_large_rate_floor_octets",
    "abnormal_max_exception_level",
    "abnormal_session_count_threshold",
    "abnormal_sigma_threshold",
    "adrf_base_url",
    "advertised_ipv4",
    "dccf_base_url",
    "energy_joules_per_gigabyte",
    "energy_static_watts_per_slice",
    "feature_store_database",
    "feature_store_host",
    "feature_store_max_rows",
    "feature_store_password",
    "feature_store_port",
    "feature_store_user",
    "fetch_buffer_ttl_seconds",
    "metrics_bind_address",
    "mtlf_base_url",
    "notification_interval_seconds",
    "nrf_base_url",
    "nrf_heartbeat_seconds",
    "port",
    "redis_url",
    "role",
    "sbi_bind_address",
    "self_base_url",
    "user_consent_policy"
  ],
  "x-config-file": "config/nwdaf.json",
  "x-source": [
    "nfs/nwdaf"
  ],
  "x-apply": "restart",
  "x-review": [
    "nf_load_default_nf_types: present in the file but no source line visibly reads it",
    "data_collection: nested object shape inferred from current values (map-vs-struct meaning unverified; new keys refused until reviewed)",
    "data_collection.nrf_status_nf_types: empty array, item type unknown",
    "ml_model_provision: nested object shape inferred from current values (map-vs-struct meaning unverified; new keys refused until reviewed)",
    "ml_model_provision.nf_types: empty array, item type unknown",
    "mtlf: nested object shape inferred from current values (map-vs-struct meaning unverified; new keys refused until reviewed)",
    "mtlf.fl_client: nested object shape inferred from current values (map-vs-struct meaning unverified; new keys refused until reviewed)",
    "mtlf.fl_server: nested object shape inferred from current values (map-vs-struct meaning unverified; new keys refused until reviewed)",
    "mtlf.fl_server.federations[]: nested object shape inferred from current values (map-vs-struct meaning unverified; new keys refused until reviewed)",
    "training: nested object shape inferred from current values (map-vs-struct meaning unverified; new keys refused until reviewed)",
    "accuracy_monitoring: nested object shape inferred from current values (map-vs-struct meaning unverified; new keys refused until reviewed)",
    "smf_base_url: present in the file but no source line visibly reads it",
    "li_poi: nested object shape inferred from current values (map-vs-struct meaning unverified; new keys refused until reviewed)",
    "accuracy_threshold: read with require<> but absent from the file (env-only?)",
    "accuracy_tolerance: read with require<> but absent from the file (env-only?)",
    "aggregate_script: read with require<> but absent from the file (env-only?)",
    "check_interval_seconds: read with require<> but absent from the file (env-only?)",
    "data_set_id: read with require<> but absent from the file (env-only?)",
    "default_max_response_seconds: read with require<> but absent from the file (env-only?)",
    "default_threshold: read with require<> but absent from the file (env-only?)",
    "enabled: read with require<> but absent from the file (env-only?)",
    "epochs: read with require<> but absent from the file (env-only?)",
    "holder_heartbeat_seconds: read with require<> but absent from the file (env-only?)",
    "learning_rate: read with require<> but absent from the file (env-only?)",
    "max_collected_events: read with require<> but absent from the file (env-only?)",
    "min_inferences: read with require<> but absent from the file (env-only?)",
    "min_report_interval_seconds: read with require<> but absent from the file (env-only?)",
    "min_samples: read with require<> but absent from the file (env-only?)",
    "mlflow_tracking_uri: read with require<> but absent from the file (env-only?)",
    "observation_window_seconds: read with require<> but absent from the file (env-only?)",
    "python: read with require<> but absent from the file (env-only?)",
    "repeat_interval_seconds: read with require<> but absent from the file (env-only?)",
    "retrain_cooldown_seconds: read with require<> but absent from the file (env-only?)",
    "retrain_interval_seconds: read with require<> but absent from the file (env-only?)",
    "retrain_min_new_windows: read with require<> but absent from the file (env-only?)",
    "retry_seconds: read with require<> but absent from the file (env-only?)",
    "round_grace_seconds: read with require<> but absent from the file (env-only?)",
    "script: read with require<> but absent from the file (env-only?)",
    "timeout_seconds: read with require<> but absent from the file (env-only?)",
    "tolerance: read with require<> but absent from the file (env-only?)",
    "training_lease_seconds: read with require<> but absent from the file (env-only?)",
    "truth_timeout_seconds: read with require<> but absent from the file (env-only?)",
    "via_dccf: read with require<> but absent from the file (env-only?)",
    "window_seconds: read with require<> but absent from the file (env-only?)",
    "workdir: read with require<> but absent from the file (env-only?)"
  ]
}
